{
  "version": "1.0.0",
  "problem": "NotebookLM 'Strategic RAG Chunking' (cea806f1) synthesizes parent-child indexing, contextual retrieval framing, layout-aware splits, and metadata filtering. agent-rules had RAG Anatomy pipeline docs but no chunk_policy module, wiki heading ingest, or eval seed for hierarchical chunks.",
  "solution": "Sixth incorporation slice: RAG_CHUNKING_MAP, chunk_policy.py, wiki_chunk_ingest bridge, contextual framing on embed, cross-encoder rerank P1, books_rag reindex P1. Reject late chunking as rule-layer default.",
  "user_stories": [
    {
      "id": "US-C1",
      "description": "Operator has RAG_CHUNKING_MAP.md linking chunk strategies to ingest scripts.",
      "priority": "P0",
      "passes": true
    },
    {
      "id": "US-C2",
      "description": "chunk_policy.py produces parent-child chunks with required metadata fields.",
      "priority": "P0",
      "passes": true
    },
    {
      "id": "US-C3",
      "description": "Wiki ingest uses heading-based layout-aware splits.",
      "priority": "P0",
      "passes": true
    },
    {
      "id": "US-C4",
      "description": "Contextual framing prepends doc title and section path before embed text.",
      "priority": "P0",
      "passes": true
    },
    {
      "id": "US-C5",
      "description": "Eval seed rag-chunking.json with binary parent/metadata assertions.",
      "priority": "P0",
      "passes": true
    },
    {
      "id": "US-C6",
      "description": "Cross-encoder rerank hook integrated with fused_rag (P1).",
      "priority": "P1",
      "passes": true
    },
    {
      "id": "US-C7",
      "description": "books_rag reindex script supports parent-child metadata (P1).",
      "priority": "P1",
      "passes": true
    }
  ],
  "technical_decisions": [
    {
      "decision": "Late chunking is out of scope until embedding stack supports it.",
      "rationale": "NotebookLM + external verification; rule-layer cannot enforce.",
      "passes": true
    },
    {
      "decision": "Extend RAG Anatomy PRD corpus half; do not reopen Geometry or Harness PRDs.",
      "rationale": "Dedup per grill cross-check.",
      "passes": true
    },
    {
      "decision": "MCP ask_question or assemble_rag_chunking_batch.py for grill; Playwright optional.",
      "rationale": "MCP unstable on some notebooks; batch script reproducible.",
      "passes": true
    }
  ],
  "execution_chain": {
    "sequence": ["notebooklm-research-gate", "write-prd", "prd-to-issues", "ralph-loop"],
    "status": "complete",
    "notes": "Master implementation plan 2026-06-24"
  },
  "verification_protocol": {
    "claim_statuses": ["VERIFIED", "INFERRED", "UNVERIFIED"],
    "external_ledger": "30_system/docs/notebooklm_rag_chunking_external_verification.json",
    "gate_report": "outputs/notebooklm/rag_chunking_gate_report.json"
  },
  "issues": [
    {
      "id": "RC-0",
      "title": "Grill batch + gate report",
      "priority": "P0",
      "passes": true,
      "maps_to_stories": []
    },
    {
      "id": "RC-1",
      "title": "RAG_CHUNKING_MAP + chunk_policy.py + tests",
      "priority": "P0",
      "passes": true,
      "maps_to_stories": ["US-C1", "US-C2"]
    },
    {
      "id": "RC-2",
      "title": "wiki_chunk_ingest + contextual framing",
      "priority": "P0",
      "passes": true,
      "maps_to_stories": ["US-C3", "US-C4"]
    },
    {
      "id": "RC-3",
      "title": "eval rag-chunking.json",
      "priority": "P0",
      "passes": true,
      "maps_to_stories": ["US-C5"]
    },
    {
      "id": "RC-4",
      "title": "rerank_ce + books_rag reindex",
      "priority": "P1",
      "passes": true,
      "maps_to_stories": ["US-C6", "US-C7"]
    }
  ]
}
